{
  "receipt_id": "r-6ce46b1d342d73d5",
  "by": "domain.terra",
  "action": "domain.freeze.v1",
  "timestamp": "2025-10-07T23:55:38Z",
  "hash": "3a8468bbd1d506d7f337d72087da0301eb30de8241cc707057073253ab80bb81",
  "provenance": [
    {
      "type": "SAT",
      "ref": "sat-demo-001",
      "status": "valid"
    },
    {
      "type": "domain",
      "ref": "domain.terra",
      "status": "valid"
    },
    {
      "type": "policy",
      "ref": "policy.freeze.rego",
      "status": "valid"
    }
  ],
  "signature": "4U6hh2vOQRMFGCg22k88qiQoGkkJriB+SfYdpF2CFxwLfG7PU10Q8H2D+Ab57+jagU62QiLQZw7qo1VHmLfTBQ==",
  "frozen_core_hash": "DIS-CORE v1.0",
  "metadata": {
    "issued_from_console": "ac-9ca23dbe",
    "issuer_seat": "uid-terracouncil-001",
    "verified_at": "2025-10-07T23:55:38Z",
    "verification_method": "SAT-check",
    "signer_public_key_b64": "toJTqxHV5yT90nUUApLZE/MXJT5bHo+gxMY3AqWEOSw="
  }
}