{
  "receipt_id": "r-299290fd327226e6",
  "by": "domain.terra",
  "action": "domain.freeze.v1",
  "timestamp": "2025-10-07T23:34:51Z",
  "hash": "5e1c5eb4a56ba844c39a54b02c2c929bc6a5784e9ffcd6ddf39f9aaa31cbabd3",
  "provenance": [
    {
      "type": "SAT",
      "ref": "sat-demo-001",
      "status": "valid"
    },
    {
      "type": "domain",
      "ref": "domain.terra",
      "status": "valid"
    },
    {
      "type": "policy",
      "ref": "policy.freeze.rego",
      "status": "valid"
    }
  ],
  "signature": "4cRDsDjeh+/sbY3FFs+Bm3/kHF4t7IZYJJvA00nJyYHohsbqzliv53otgk/IGABj",
  "frozen_core_hash": "DIS-CORE v1.0",
  "metadata": {
    "issued_from_console": "ac-a6de4e15",
    "issuer_seat": "uid-terracouncil-001",
    "verified_at": "2025-10-07T23:34:51Z",
    "verification_method": "SAT-check"
  }
}